{
  "$schema": "http://json-schema.org/draft-07/schema#",
  "title": "Planner Output Schema",
  "description": "Framework-level planner agent output schema. Defines the structure for task breakdowns, milestones, and risks.",
  "type": "object",
  "required": ["metadata", "tasks", "milestones"],
  "properties": {
    "metadata": {
      "type": "object",
      "required": ["plannerVersion", "generatedAt", "source", "taskCount"],
      "properties": {
        "plannerVersion": { "type": "string" },
        "generatedAt": { "type": "string", "format": "date-time" },
        "source": { "type": "string", "enum": ["human", "planner-agent", "system"] },
        "taskCount": { "type": "integer", "minimum": 1 },
        "assumptions": { "type": "array", "items": { "type": "string" } }
      }
    },
    "tasks": {
      "type": "array",
      "minItems": 1,
      "items": {
        "type": "object",
        "required": ["id", "title", "module", "priority", "status", "dependencies", "acceptanceCriteria", "definitionOfDone", "estimate", "assignee"],
        "properties": {
          "id": { "type": "string", "pattern": "^TASK-[0-9]{3,}$" },
          "title": { "type": "string", "minLength": 10 },
          "module": { "type": "string", "minLength": 2 },
          "priority": { "type": "string", "enum": ["P1", "P2", "P3"] },
          "status": { "type": "string", "enum": ["todo", "in_progress", "blocked", "review", "done", "cancelled"] },
          "dependencies": { "type": "array", "items": { "type": "string", "pattern": "^TASK-[0-9]{3,}$" } },
          "acceptanceCriteria": { "type": "array", "minItems": 1, "items": { "type": "string", "minLength": 10 } },
          "definitionOfDone": { "type": "array", "minItems": 1, "items": { "type": "string", "minLength": 10 } },
          "estimate": { "type": "string", "pattern": "^[0-9]+[mhdw]$" },
          "assignee": { "type": "string", "enum": ["architect", "coder", "reviewer", "debugger"] },
          "milestoneId": { "type": "string", "pattern": "^MS-[0-9]{3}$" },
          "description": { "type": "string", "minLength": 20 },
          "technicalNotes": { "type": "string" }
        }
      }
    },
    "milestones": {
      "type": "array",
      "items": {
        "type": "object",
        "required": ["id", "title", "tasks", "targetDate"],
        "properties": {
          "id": { "type": "string", "pattern": "^MS-[0-9]{3}$" },
          "title": { "type": "string", "minLength": 5 },
          "description": { "type": "string", "minLength": 20 },
          "tasks": { "type": "array", "minItems": 1, "items": { "type": "string", "pattern": "^TASK-[0-9]{3,}$" } },
          "targetDate": { "type": "string", "format": "date" },
          "status": { "type": "string", "enum": ["planned", "in_progress", "completed", "delayed"] }
        }
      }
    },
    "risks": {
      "type": "array",
      "items": {
        "type": "object",
        "required": ["description", "probability", "impact"],
        "properties": {
          "description": { "type": "string", "minLength": 10 },
          "probability": { "type": "string", "enum": ["low", "medium", "high"] },
          "impact": { "type": "string", "enum": ["low", "medium", "high", "critical"] },
          "mitigation": { "type": "string" }
        }
      }
    }
  }
}